_id,prefix,suffix,oldPart,newPart,prevSent,nextSent,label
ObjectID(5527e723a21edceb734d43e7),"Mercury (, ) is the","planet in the solar system, orbiting the Sun once every 88 minutes.","outermost and windy","innermost and smallest","","It ranges in brightness from about −2.0 to 5.5 in apparent magnitude, but is not easily seen as its greatest angular separation from the Sun (greatest elongation) is only 28.3°.","Factual"
ObjectID(5527e1dba21e5709f6e9681b),"In 2009, the BBC made a 180-minute full-length feature of Hamlet,","","shown on Christmas Day on BBC 1.","which aired on 26th December 2009.","The lead characters, Jackson ""Jax"" Teller, Clay Morrow, Gemma Teller Morrow and Tara Knowles are representative of Prince Hamlet, King Claudius, Gertrude and Ophelia, respectively.","This was a television adaptation of the Royal Shakespeare Companys stage adaptation selling out early in the year.","Factual"
ObjectID(5527e03ca21e5709f6e96311),"Claudius proposes a rigged fencing-match, using poisoned rapiers,","Laertes' revenge, backed up with a cup of poisioned wine in case the first plan fails.","as a means of achieving","to achieve","Letters arrive, indicating that Hamlet is returning.","Gertrude interrupts to report that Ophelia has drowned.","Paraphrase"
ObjectID(5527f45ea21e0e4c0a9e0845),"Several types of supernovae exist that may be triggered in one of two ways, involving either turning off or suddenly","through nuclear fusion.","touching something hot","turning on the production of energy","This shock wave sweeps up an expanding shell of gas and dust called a supernova remnant.","After the core of an aging massive star ceases to generate energy from nuclear fusion, it may undergo sudden gravitational collapse into a neutron star or black hole, releasing gravitational potential energy that heats and expels the star's outer layers.","Factual"
ObjectID(5527e087a21edceb734d187a),"Since his connection with Reagan, he/she has become increasingly involved in gay issues, both","","domestically and internationally.","anal and oral."," and is regarded as a Hermaphrodite. His former marriage to Denis Rodman and current relationship with Ronald Reagan have been widely covered in the world media. He is the father/mother of four children with Rodman, one biological, all of whom have also received hermaphroiditism.","Early life","X"
ObjectID(5527e35ea21e0e4c0a9dcd27),"Tweedy was enraged","from Margherita, since Farrar decided not to tell him in person.","after hearing the news","that he heard the news secondhand","It had ceased to be a symbiotic songwriting relationship, probably after the first record."" Last accessed June 8, 2007.","The following day, the two singers engaged in a barbarous verbal confrontation..Kot 2004.","Factual"
ObjectID(5527ef7aa21e5709f6e9bf37),"Because co-occurring conditions like OCD or attention-deficit hyperactivity disorder can be more impairing than tics, these conditions should be","patients presenting with tics.","ruled out in","included in an evaluation of","Most of these conditions are rare, and many physicians well-versed in the treatment of Tourette's are comfortable conferring a diagnosis based on history, and without a lot of medical or screening tests.","Prognosis","Factual"
ObjectID(5527eb3da21edceb734d5627),"A Howard faculty member, Ethel Robinson, encouraged Hedgeman","Brown University sorority experiences.Ross 2000, op.","and shared her","by relating her own experiences in a sorority at","In Spring 1907, Ethel Hedgeman led the efforts to create the sisterhood of Alpha Kappa Alpha at Howard University.","cit., p.","Factual"
ObjectID(5527d864a21e5709f6e93d9f),"The 1972 concert tour was cancelled, but Lennon","the ""Free John Sinclair"" concert in Ann Arbor, Michigan, in December 1971.","and his friends did put on","did perform at","The Nixon Administration found out about Lennon's plans from an unlikely source: Republican Senator Strom Thurmond, who suggested in a February 1972 memo that ""deportation would be a strategic counter-measure."" The next month the Immigration and Naturalization Service began deportation proceedings against Lennon, arguing that his 1968 misdemeanour conviction for cannabis possession in London had made him ineligible for admission to the U.S. Lennon spent the next two years in deportation hearings and under a 60-day order to leave the country, which his attorney managed to get repeatedly extended.","Sinclair was a local antiwar activist and poet who was serving ten years in state prison for selling two joints of marijuana to an undercover cop.","Paraphrase"
ObjectID(5527df0aa21e5709f6e956f0),"It concerns the moral and psychological dilemma of Hamlet, whose father has been murdered by his uncle, Claudius, and who has moreover usurped the throne which","","is rightfully his.","rightfully belongs to Hamlet.","A tragedy by William Shakespeare, one of his most well-known and oft-quoted plays.","","Paraphrase"
ObjectID(5527eec6a21e3a63c2aca982),"On March 30, 1981, Reagan, his press secretary James Brady, and two others  were shot by","","John Hinckley, Jr..","Phillip Moyer.","","Missing Reagan’s heart by less than one inch, the bullet instead struck his left lung, which likely spared his life.","Factual"
ObjectID(5527d60aa21e4a5a1c937d59),"At the Conservatoire Bizet studied under Fromental Halévy, whose daughter Geneviève he","","later married.","married in 1869.","A delightful work (and a prodigious one, from a seventeen-year-old boy), the symphony is noteworthy for bearing an amazing stylistic resemblance to the music of Franz Schubert, whose work was virtually unknown in Paris at that time (with the possible exception of a few of his songs).","Halévy died in 1864, leaving his last opera Noé unfinished.","Paraphrase"
ObjectID(5527f241a21e3a63c2acb13c),"324 Critics argue that his economic policies caused huge budget deficits, tripling the United States national debt,","hostility towards the disadvantaged.","and creating a","creating a recession in early 90s and","Reagan's supporters, and even some who are not, believe that much of America's success today can be attributed to Ronald Reagan, including a more efficient and more prosperous economy; a peaceful end to the Cold War; and a World safer from the threat of nuclear war.Beschloss, Michael (2007), pp.","Today, Ronald Reagan is one of America's most popular presidents.","Factual"
ObjectID(5527f5b9a21e0e4c0a9e0f0d),"The track was produced by Scott Storch for","studio album Dangerously in Love.","Knowles debut solo","Knowles' debut","""Baby Boy"" is a R&B–reggae song by American singer Beyoncé Knowles, and features Jamaican reggae rapper Sean Paul.","The song was written by Knowles, Storch, Paul, Robert Waller and Jay-Z.","Factual"
ObjectID(5527d6e4a21e5709f6e9366e),"The name came from a flower Lennon saw at","he liked the name, and thought it was a perfect description of his marriage to Yoko.","an exposition;","the Bermuda Botanical Gardens;","For this comeback, he and Ono produced Double Fantasy, a concept album dealing with their relationship.",""" The Lennons once again began a series of interviews and video footage to promote the album.","Factual"
ObjectID(5527ea08a21e5709f6e98f22),"In Brian Antoine's online serial novella Tales of the Family nas Kan, a sci-fi/magic-based","inhabits a planet in the Tau Ceti system.","furry society","society of anthropomorphic animals","In The Powers of Matthew Starr, the planet Quadris is identified as being a planet of Tau Ceti.","In Ursula K. Le Guin's The Dispossessed, the action takes place in a fictional double planet system orbiting Tau Ceti.","Factual"
ObjectID(5527ec79a21e5709f6e9a483),"","","6/31 and 112* in a single ODI vs, Bangladesh in 2005","First Durham CCC player to score a Test century and double century for England","Sri Lanka in 2006","Man of the Match Awards","X"
ObjectID(5527d949a21e3a63c2ac41b4),"The late departures may have","the difficulties of dealing with the unexpected demand and in procuring ships, but the results would be tragic.Hafen and Hafen (1981), p.","resulted from","been the result of","The ship, Thornton, carrying the emigrants who would become the Willie Company, did not leave England until May 4, and another three weeks passed before the Horizon, carrying the emigrants who would form the Martin Company, departed.","91.","Paraphrase"
ObjectID(5527ea08a21e5709f6e98f15),"In the film version of Barbarella, the decadent","in the Tau Ceti system.","planet Sogo is","city of Sogo is on a planet","In Isaac Asimov's Robot and Foundation novels, the planet Aurora and its two asteroidal satellites orbit Tau Ceti.","In Harry Turtledove's Worldwar series this is the home star of the invading aliens known as the Race.","Factual"
ObjectID(5527dd92a21e4a5a1c93a0b0),"Newsweek ranked Amador Valley High School","2007 list of the 1200 Best High Schools in America.","328th in its May 28,","334th in its","In 2006, Amador Valley was voted as Pleasanton's Most Spirited High School ","1994, 2001, 2005 California Distinguished School","Factual"
ObjectID(5527d823a21e0e4c0a9d9a06),"The film spent two months of pre-production in creating","spears and 65 swords, although some were recycled from Troy and Alexander.","126 shields, 260","125 shields, 250","Dilios was used by Snyder to show the audience that the surreal ""Frank Miller world"" of 300 was through the perspective of Dilios taking artistic license in his storytelling about the Battle of Thermopylae. Snyder also added the sub plot of Queen Gorgo trying to rally support for her husband.","The actors trained alongside the stuntmen, and even Snyder joined in.","Factual"
ObjectID(5527eba4a21e3a63c2ac96e8),"His financial circumstances also deteriorated,","the target of a successful lawsuit by a cook named George Goodale, who was seeking payment of a debt of 80 pounds.","having been","after he was","Unable to rely on the protections and privileges of the now defunct monopoly, Barley most likely came under increasing pressure from the Stationers' Company.","As a result of the suit, a large number of Barley's goods were seized, including various books and reams of paper.","Paraphrase"
ObjectID(5527e03aa21edceb734d1613),"Since his film Mr. and Mrs. Smith, Brad had an affair with his co-star Angelina Jolie and Aniston filed for a divorce on March","","25 the same year.","25, 2005.","In 1998, Pitt met Friends actress Jennifer Aniston and married her at an enclosed wedding ceremony in Malibu on July 29, 2000.","The divorce was finalized on October 2 2005.","Factual"
ObjectID(5527dc58a21e4a5a1c939b40),"Born and raised in Liverpool, Lennon was influenced by the skiffle","rock and roll became a significant influence.","craze, later","craze as an early teen and","John Winston Ono Lennon, MBE (9&nbsp;October 1940 – 8&nbsp;December 1980) was an English musician and singer-songwriter who rose to worldwide fame as one of the founding members of The Beatles and, with Paul McCartney, formed one of the most successful songwriting partnerships of the 20th century.","His first band, The Quarrymen, evolved into The Beatles in 1960.","Factual"
ObjectID(5527e76fa21e5709f6e981d8),"Texas Tech University, often referred to as","is a public, coeducational, research university in Lubbock, Texas, United States.","TTU or Texas Tech,","Texas Tech or TTU,","","Established on February 10, 1923, and originally known as Texas Technological College, it is the leading institution of the Texas Tech University System and has the seventh largest student body in the state of Texas.","Paraphrase"
ObjectID(5527ef64a21e0e4c0a9ded4e),"The Robot Devil","he agreed to be punished for sinning when he joined Robotology.","informs Bender that","reminds Bender","He awakens to see the Robot Devil and finds himself in Robot Hell.","After discovering Bender is missing, Fry and Leela attempt to track him down using Nibbler's sense of smell.","Paraphrase"
ObjectID(5527dd34a21e4a5a1c939eda),"Following the entry of German forces into Bulgaria,","Greek troops were evacuated from Western Thrace.","most of the","the majority of","At the time of the German attack the Yugoslav troops  were not yet fully mobilized, and lacked a sufficient amount of modern equipment or weapons to fully counteract.","The total strength of the Greek forces defending the Bulgarian border was roughly 70,000 men under the command of the Greek Second Army.","Paraphrase"
ObjectID(5527df9aa21e3a63c2ac6679),"Critical reaction was mostly positive, and Michael Westmore","Best Makeup.","earned an Academy Award-nomination for","was nominated for the","Paramount gave the film a larger budget than any previous Star Trek film, which enabled the use of more visual effects.","Plot","Paraphrase"
ObjectID(5527d6a8a21e5709f6e9352a),"It has been suggested that the change of the song's lyrics was due to","","Lennon's worship of Tufano's art.","Ono's persuasion of Lennon.","This lyric was changed to ""I just believe in me/Yoko and me/And that's reality"" when the song was included on the Plastic Ono Band album.","One of his closest friends was actor Marc Tufano (Everybody Loves Tufano).","Factual"
ObjectID(5527ee55a21e5709f6e9b3c0),"The Rosetta Stone is a basalt stone discovered in Rosette in July 1799","","by a French expedition.","while Napoleon was invading Egypt.","","Written on it was a text in Egyptian and Greek.","Factual"
ObjectID(5527f53ca21e0e4c0a9e0b97),"","on a dark body.","SNOWFLAKE (sometimes called a ""reverse leopard"" - white spots","SNOWFLAKE w A horses with white spots, flecks,","Some may have as few as only one or two spots.","Typically the white spots increase in number and size as the horse ages.","Other"
ObjectID(5527efaaa21e0e4c0a9defda),"The rush started at Sutter's Mill near Coloma, California","","in 1849","on January 24, 1848 when James W. Marshall, an employee of","Most, however, only found enough gold to barely pay for their daily expenses.","","Factual"
ObjectID(5527d80da21e0e4c0a9d98f6),"They have had 18 straight seasons over .500;","the Detroit Red Wings.","second only to the 20 by","tied with","However, under current president and general manager Lou Lamoriello, the Devils have made the playoffs in 20 out of the last 22 seasons, including each of the last 13.","They have qualified for four Stanley Cup Finals winning three Stanley Cups in their history.","X"
ObjectID(5527df88a21e5709f6e95ece),"Hamlet begins with Francisco on watch duty at Elsinore","to Horatio, Hamlet's friend.","Castle in Denmark, and","Castle, on a cold,","The play is set at Elsinore Castle, (which is based on the real Kronborg Castle, Denmark.) The time period of the play is somewhat uncertain, but can be understood as mostly Renaissance, contemporary with Shakespeare's England.","The sentries notify the prince, prompting his investigation into the matter.","X"
ObjectID(5527ed13a21edceb734d6116),"The music for Call of Duty 4: Modern Warfare was mostly written by British composer Stephen Barton, who had also contributed","by Harry Gregson-Williams.","music to films scored","to film scores","Audio","Gregson-Williams also composed some additional music for the game, such as the main theme.","Paraphrase"
ObjectID(5527e566a21e3a63c2ac8023),"In 1990, following the Hillsborough Disaster, a report was issued requiring all stadia be converted to","subsequent renovation, which dropped capacity to around 44,000.","all-seaters, leading to","all-seaters and","44-45","However, in 1995, the North Stand was redeveloped into three tiers, bringing the capacity up to approximately 55,000.","Paraphrase"
ObjectID(5527dac5a21e5709f6e946a1),"After a self-imposed ""retirement""","Lennon reemerged with a comeback album, Double Fantasy, but was murdered less than one month after its release.","from 1976 to 1980,","to raise his son,","-->""Give Peace a Chance"" and ""Imagine"".","The album would go on to win the 1981 Grammy Award for Album of the Year.","Factual"
ObjectID(5527e96da21e3a63c2ac91a2),"Among them, the Sunnis form the most populous sect, while","of the local Muslims are Alevis.","approximately 15 to 30%","a number","The Muslims are the largest religious group in Istanbul.","In 2007 there were 2,944 active mosques in Istanbul.Vatan - Diyanet: Türkiye’de 79 bin 096 cami var","Factual"
ObjectID(5527e616a21e3a63c2ac81e3),"The club currently","Premier League, of which they were founding members in 1992.","play in the","plays in the FA","Manchester United Football Club is an English professional football club based in Stretford, Greater Manchester.","Having won a joint-record 18 league titles, four League Cups and a record 11 FA Cups, Manchester United is one of the most successful clubs in the history of English football and one of the wealthiest and most widely supported football teams in the world. Alex Ferguson has been manager since 6 November 1986 and is the most successful manager in the club's history, having won 26&nbsp;major honours","Factual"
ObjectID(5527dafaa21e0e4c0a9da8ca),"It had previously operated under the Julian Calendar,","the Gregorian Calendar.","but, after 1752, used","but during 1752 adopted","In 1752, Great Britain reformed its calendar.","Furthermore, 1 January became the official beginning of the New Year, instead of 25 March.","Paraphrase"
ObjectID(5527e4c4a21e5709f6e97378),"The Emperor Penguin, along with nine other species of penguin, is currently being considered for placement under","","the Endangered Species Protection Act.","my bed.","Conservation status","The primary reasons for this are declining food availability due to the effects of climate change, and industrial fisheries on the crustacean and fish populations.","Other"
ObjectID(5527e579a21e0e4c0a9dde09),"If both of the cup winners qualify for Europe through their league position, the","teams in the Premier League will qualify for the Europa League.","6th and 7th-placed","sixth and seventh-placed","If one of the cup winners qualifies for Europe through their league position, the sixth-placed team in the Premier League will qualify for the Europa League.","Cup runners-up will not qualify for Europe unless they do so through their league finish.cite web | url =  | title = Could it be seventh heaven?","Paraphrase"
ObjectID(5527dc93a21e5709f6e94ae2),"According to biographer Philip Norman, one of his reasons for","he was physically attracted to Lennon.","doing so was that","wanting to the manage the group was because","A record store manager, Epstein was homosexual, at a time of strong and widespread social prejudice against homosexuality.","Biographer Bill Harry disagrees, saying the band ""were not the type of sexual partners Brian was interested in"".","Paraphrase"
ObjectID(5527e797a21edceb734d46fa),"Mercury’s surface is","showing extensive mare-like plains and heavy cratering, indicating that it has been geologically inactive for billions of years.","very dum,","overall very similar in appearance to that of the Moon,","","Since our knowledge of Mercury's geology is based on only a single spacecraft flyby, it is the least well understood of the terrestrial planets.","X"
ObjectID(5527ea2ea21e5709f6e99101),"The nobility's condescending attitude towards the commoners was present as late as the 1950s (Sandra 1998), and the nobility is still","of family prestige.","maintained, because","maintained for reasons","There were three strata: nobles, commoners, and slaves, although the latter was abolished in 1909 by the Dutch East Indies government.","Nobles, who are said to be direct descendants of a person (to manurun) descended from heaven (Wellenkamp 1988), lived in tongkonans, while commoners lived in a less lavish houses.","Paraphrase"
ObjectID(5527d644a21e4a5a1c938115),"","Esther caused seven indirect deaths when a Navy P5M aircraft crashed.","Despite the relatively minimal land damage,","While over open waters,","Navy plane crash","The plane crashed about 120 miles (195 km) north of Bermuda.","X"
ObjectID(5527d624a21e3a63c2ac30d0),"","""The federal flag shall be black, red, and gold.""","Article 22 of the Geran basic law (constitution) says, that","In the Basic Law for the Federal Republic of Germany — the German constitution — Article 22 states:","350px|right|Specifications for the flag of Germany","Following specifications set by the (West) German government in 1950, the flag displays three bars of equal width and has a width-length ratio of 3:5. The flag used during the Weimar Republic was slightly different, with a ratio of 2:3.","X"
ObjectID(5527e3cda21e5709f6e96e3a),"Three celestial globes are in Germany, one each in Zerbst, Nuremberg (at the Germanisches Nationalmuseum (German National Museum)) and Kassel (Hessisches Landesmuseum","Kassel).","(Museum of Hesse),","(Hesse Museum),","It appears that only six Molyneux globes are in existence today, two terrestrial globes and four celestial globes.","The Hessisches Landesmuseum originally had a 1592 terrestrial globe, but this is believed to have been destroyed during World War II.","Paraphrase"
ObjectID(5527dd13a21e5709f6e94d19),"Consultation on the elimination of Female Genital Mutilation:","1998.","14-16 December,","14 December -16 December","394-412.","UNICEF, NY,1999, 40p.","Paraphrase"
ObjectID(5527d6a8a21e3a63c2ac3463),"They were meant for mainly townsmen, who","an original painting.","weren't rich enough to buy","were generally not wealthy enough to afford","Ukiyo-e were affordable because they could be mass-produced.","The original subject of Ukiyo-e was city life, in particular activities and scenes from the entertainment district.","Paraphrase"
ObjectID(5527e43ba21edceb734d2de8),"","suggests that prior to the capture Triton may have had a massive companion similar to Pluto's moon Charon.","A recent theory","Theoretical work","","When the binary encountered Neptune, Triton's companion was expelled providing the required mechanism to capture Triton in an orbit around the planet.","Paraphrase"
ObjectID(5527e771a21e3a63c2ac89d5),"The headquarters","Hürriyet, Milliyet, Sabah, Tercüman, Milli Gazete, Zaman, Yeni Asya, Cumhuriyet.","in Istanbul, including","of publisher in includes","Most newspapers are based in Istanbul, with simultaneous Ankara and İzmir editions.","Local Tv stations exists.","Factual"
ObjectID(5527f02fa21e3a63c2acad6a),"As an adult, Reagan was a member of Bel Air Presbyterian","during his presidency.","Church but never attended church regularly, including","Church, but didn't attend regularly","""My parents constantly drummed into me the importance of judging people as individuals"", Reagan recalled.","In a March 1978 letter to a Methodist minister who was skeptical about Christ's divinity&mdash;and accused Reagan of a ""limited Sunday school level theology""&mdash;Reagan argued strongly for Christ's divinity, using C.S. Lewis's Trilemma.","Paraphrase"
ObjectID(5527de65a21e5709f6e9520e),"Its colors were red, green, and blue respectively,","","but its symbolism is unknown.","representing the band of colors that Noah saw after landing on Mount Ararat.","While in France, Alishan also designed a second flag, identified today as the ""Nationalist Armenian Flag.""  It too was a tricolor, however, it was a vertical tricolor, like the French flag.","Democratic Republic of Armenia","Factual"
ObjectID(5527df0fa21edceb734d0e08),"He","","owns a house in the picturesque town of Carmel-by-the-Sea, California.","is very interested in architecture, has studied Computer aided design and counts Frank Gehry as a friend and mentor.","He has been awarded a Blue Peter badge.","Filmography","Other"
ObjectID(5527e8fea21e5709f6e98b7c),"","Nikita Sergeyevich Khrushchyov; , in English, , ,  or , occasionally ; ()&nbsp;– September 11, 1971)According to official Soviet sources and his memoirs.","Nikita Sergeyevich Khrushchev (,","'Nikita butt whole(,","","His birth certificate gives 3/15 April.","Other"
ObjectID(5527e3cfa21e0e4c0a9dd315),"The","enter the competition at the third qualifying round and must win a two-legged knockout tie in order to enter the group phase.","third and fourth placed teams","fourth ands","The top six teams in the Premiership qualify for the UEFA Champions League, with the top three teams directly entering the group phase.","The fifth placed team automatically qualifies for the UEFA Cup, and the sixth and seventh placed teams can also qualify, depending on what happens in the two domestic cup competitions.","Other"
ObjectID(5527d73ca21e5709f6e93936),"He has been denied parole several times and remains incarcerated at","","Sullivan Correctional Facility.","Attica Prison.","Chapman pleaded guilty to second degree murder and was sentenced to 20 years to life.","Memorials and tributes","Factual"
ObjectID(5527f361a21e0e4c0a9e0314),"Research into the effectiveness of controlling population levels by the use of implanted contraceptives was begun in 2005, but in July 2007 the","culled instead.","population was","research was discontinued and the population","By the 2000s, there were over 400 wallabies on the island, resulting in overgrazing of native vegetation and increased erosion.","Reptiles","Paraphrase"
ObjectID(5527e4dda21edceb734d33ee),"It should render correctly on any application that follows the World Wide Web Consortium and Internet Engineering Task Force specifications","","in these areas.","for these technologies.","Acid2 tests aspects of HTML markup, CSS styling, PNG images, and data URIs.","The idea is that if all developers follow agreed-upon industry standards, both web site developers and web browser developers can rest assured that their sites and programs will work together seamlessly.","Paraphrase"
