_id,prefix,suffix,oldPart,newPart,prevSent,nextSent,label
ObjectID(5527f199a21e3a63c2acb00b),"Several scandals","the most notable being the Iran-Contra Affair in 1986.","during his Presidency,","are associated with his administration,","Reagan was reelected by a landslide in 1984, after surviving an assassination attempt.","Reagan pursued a foreign policy of ""peace through strength"" by enacting the largest peacetime military budget in American history, including modernizing America's weapons systems. He rejected détente and confronted Communism, famously portraying the Soviet Union as an ""Evil Empire"" and bolstering anti-Communist movements worldwide.  Cato Institute Policy Analysis No.","Paraphrase"
ObjectID(5527f2f8a21e0e4c0a9e0008),"","","She belived that she did not need the church to praise and worship god","."" shows the frustration of Puritan women who for the most part, wisely kept feelings and words private.","."" shows the frustration of Puritan women who for the most part, wisely kept feelings and words private.","Home Bible study group","X"
ObjectID(5527de18a21e4a5a1c93a4f5),"The current flag is very similar to the 1951 flag used while a republic of the Soviet Union,","modifications.","except with a few","with some","This new design replaced a historical flag used by Belarus before and after being a Soviet Republic.","A few groups have continued the use of the former flag, which was used from 1991 until 1995, though its use in Belarus has been restricted by the government of Alexander Lukashenko.","Paraphrase"
ObjectID(5527e6fba21e5709f6e98031),"Two members of the band Larry Gatlin and the Gatlin Brothers are alumni as are country music","and folk rocker John Denver.","singer Pat Green","singers Pat Green, Cory Morrow","The school's influence on the business world is seen in such people as former AT&T Chairman and CEO Edward Whitacre, Jr. and Finisar's Jerry S. Rawls.","In the sports world, Texas Tech Red Raiders have gone on to play in the NFL, NBA, WNBA, Major League Baseball, and more.","Factual"
ObjectID(5527e8ffa21edceb734d4fe4),"For","only two versions of his origins were available.","a long time","many centuries","Because written sources of the era are scarce, Gediminas' ancestry and early life are not well-known and continue to be the subject of scholarly debate.","Chronicles written long after Gediminas' death by the Teutonic Knights, a long-standing enemy of Lithuania, claimed that Gediminas was an hostler to Grand Duke Vytenis.; according to these chronicles, Gediminas killed his master and assumed the throne.","Paraphrase"
ObjectID(5527e409a21e5709f6e9718a),"Emperor penguin chicks are covered with a thick layer of","","light gray down.","ball sacks.","300px|left|thumb|Emperor penguin chick","This covering ensures that they retain as much heat as possible, vital at this early stage when they are not capable of maintaining their body temperature.","Paraphrase"
ObjectID(5527e2fca21e0e4c0a9dcb1a),"","Speedman and attempt an escape in Underwood and Tayback's recaptured helicopter.","Chino, Portnoy, Sandusky, and Lazarus locate","The four actors locate Tayback, Underwood, and","When the gang realizes that the suspected DEA agents are only actors using guns filled with blanks, they begin firing on the actors.","After rejoining with Tayback and crossing a bridge that Underwood has previously rigged to detonate, they meet up with Underwood at the helicopter.","Factual"
ObjectID(5527d6f1a21e5709f6e93745),"Polanski's wife, Sharon Tate, was murdered by the Manson Family as part of a plot inspired by","","a Beatles song Helter Skelter.","Beatles songs.","An eerie bit of trivia is that the Dakota was the setting for much of the horror film Rosemary's Baby, directed by Roman Polanski.","Lennon was cremated, his ashes kept by Yoko Ono.","Paraphrase"
ObjectID(5527e515a21e5709f6e975c6),"Maraba Coffee (Kinyarwanda: Ikawa ya Maraba; French: Café de Maraba) is a","in the Maraba area of southern Rwanda.","""Fairtrade"" coffee grown","Fairtrade coffee produced","thumb|right|220px|A packet of Maraba coffee as sold in Rwanda","Maraba's coffee plants are the Bourbon variety of the Coffea arabica species and are grown on fertile volcanic soils on high-altitude hills.","Paraphrase"
ObjectID(5527ef42a21e0e4c0a9dea15),"In 1908","of York, despite his relatively junior status as a suffragan rather than a diocesan bishop.","Lang was nominated Archbishop","Wang was masturbating on the boobs","He also served as a sex machine of St Paul's Cathedral, London.","His religious stance was broadly Anglo-Catholic, tempered by the liberal Catholicism advocated in the Lux Mundi essays.","Other"
ObjectID(5527f102a21e3a63c2acaf04),"Reagan appointed a non-partisan,","to review the scandal, called the Tower Commission.","three man commision","three-man commission","Despite a United Nations General Assembly resolution   demanding compliance, the U.S. never paid the required fine and since 1991, relations with Nicaragua were friendly.","Headed by John Tower, the other two members were Edmund Muskie and Brent Scowcroft.","Paraphrase"
ObjectID(5527e212a21edceb734d2002),"Barbera took art classes at the Art Students League of New York and the Pratt Institute and was hired to work in the","of the Fleischer Studios.","Painting Department","ink and paint department","His magazine drawings of single cartoons, not comic strips, began to be published in Redbook, Saturday Evening Post, and Collier's&mdash;the magazine with which he had the most success. Barbera also wrote Walt Disney for advice on getting started in the animation industry. Disney wrote back, saying he would call Barbera during an upcoming trip to New York, but the call never took place.","In 1932, he joined the Van Beuren Studios as an animator and scriptwriter. He worked on cartoons such as Cubby Bear and Rainbow Parades, and also co-produced Tom and Jerry.","Paraphrase"
ObjectID(5527eca5a21e5709f6e9a6d8),"He is a regular member of the England Test side and captain of the","","ODI team.","One-D He is also vice-captain of his county, Durham County Cricket Club.","Paul David Collingwood MBE (born 26 May 1976), is an English cricketer.","He is also vice-captain of his county, Durham County Cricket Club.","Factual"
ObjectID(5527e496a21edceb734d30ca),"As Arthur Conan Doyle's Sherlock Holmes once","","said that ""Doctors make the cleverest criminals"" for that reason.)","remarked, ""When a doctor does go wrong he is the first of criminals.""","Other crime shows—""Diagnosis Murder"", for instance—feature episodes in which doctors and police themselves use the access they have to information to commit crimes in ways that are difficult to detect.","Even on the show itself, not all cases are solved in the end.","Paraphrase"
ObjectID(5527e726a21e3a63c2ac882a),"According to 2000 Census, the population is 8,803,468 (city proper) and 10,018,735 (city proper), making it","in Europe.","one of the largest cities","the second largest city","Istanbul became the third capital of the Ottoman Empire (1290-1922) in 1453.","The census bureau estimate for July 20, 2005 is 11,322,000 for the province, which is generally considered as the metropolitan area, making it one of the twenty largest metropolitan areas in the world.","Factual"
ObjectID(5527e35ea21e0e4c0a9dcd12),"Bands playing in similar","Brian Henneman's Chicken Truck would play there, and by late 1988 the bar became reputed for having a new music scene.Kot 2004.","styles such as","style, including","25-6 Uncle Tupelo began to play regular shows at Cicero's Basement&mdash;a bar close to the campus of Washington University.","p.","Paraphrase"
ObjectID(5527d66aa21e5709f6e93280),"1974 ""Whatever Gets You Through the Night"" (with The Plastic Ono Nuclear Band)","","#36 UK, #1 US","#1 US, #36 UK","1973 ""Mind Games"" #18 US, #26 UK","1975 ""Number 9 Dream"" #23 UK, #9 US","Paraphrase"
ObjectID(5527dd25a21e4a5a1c939e4b),"To enter northern Greece, the German army was forced to cross the Rhodope Mountains,","river valleys permitted the passage of major military units.","where only a few passes and","which allowed few passes or","Topography","Two invasion routes led across the passes west of Kyustendil along the Yugoslav-Bulgarian border and another one through the Strimon Valley in the south.","Paraphrase"
ObjectID(5527eed5a21e0e4c0a9de7b4),"Hader said of his role with the","really Trey and Matt who kind of write everything, and you're just in the room kind of helping them.","show, ""It's","show that ""it's","Frank C. Agnone II served as supervisor producer, while Eric Stough, Adrien Beard, Vernon Chatman, Bruce Howell and Erica Rivinoja served as producers. Saturday Night Live cast member Bill Hader, who had previously worked as a consultant on the show, was credited as a producer.","Basically, I'm friends with them and they're just nice enough to invite me into the room and let me goof around."" Ryan Quincy served as director of animation during the season.","Paraphrase"
ObjectID(5527ec9ea21e3a63c2ac9e43),"Reagan's policies in regards to AIDS and","became a subject of controversy after his death.","gay rights","special rights for homosexuals","HIV, the virus which causes AIDS, would not be identified until 1983.) Reagan himself first publicly discussed the federal government's role in fighting the disease at a press conference in 1985.","Liberals and libertarians pointed out that he had gone on record as supporting sodomy laws, opposing anti-discrimination laws including sexual orientation, and the conservative United States Supreme Court Justices that he appointed would help produce the majority opinion in the 1986 case of Bowers v.","Paraphrase"
ObjectID(5527ea3ea21e5709f6e991df),"Tana Toraja was first a subdivision of the Luwu","area.","kingdom, because they claimed that","kingdom which had claimed the","The name was thus, not taken from the Toraja language itself, but from an outsider's point of view.","In 1946, the Dutch granted Tana Toraja as a regentschap.cf.","Paraphrase"
ObjectID(5527d632a21e4a5a1c938032),"A","from the family are displayed at Lundy's Lane Historical Museum in Niagara Falls, Canada.","ladle and dish","cup and saucer","Laura and James are buried in Drummond Hill Cemetery in Niagara Falls, Ontario at a monument (with a bust of Laura on top) close to that marking the Battle of Lundy's Lane.","Laura Ingersoll Secord died in 1868 at age 83 at the Village of Chippawa (today part of Niagara Falls, Ontario).","Factual"
ObjectID(5527e2a0a21edceb734d2606),"India is the","country in the world, with only China having a larger population.","second most populous","worst fucking","","Language, religion, and caste are major determinants of social and political organisation within the highly diverse Indian population today.","Other"
ObjectID(5527db04a21e3a63c2ac4e4e),"","sought to learn of nature and military matters rather than mathematics, literature, good writing, foreign languages, theology, or philosophy.","Instead, he","Robert K. Massie and Henry Smith Williams state that Peter","Zotov left on a diplomatic mission to the Crimea in 1680 for three years, but with contradicting sources, this could be either before or after his tutoring of Peter. But after Zotov, Peter never again had a regular tutor. When Peter left the Kremlin to spend his childhood at Preobrazhenskoye, just two years after Zotov left, his memories of the tutors who had taught his siblings Feodor and Sophia were so negative that he cut himself off from the traditional academic subjects.","In later years, he regretted this choice. Zotov disappears from the records of Russian history at this point, but reappears in 1692.","Factual"
ObjectID(5527e505a21edceb734d35af),"The war interrupted Headley's career; although he returned to Tests","hampered by injuries.","afterwards, he did not enjoy the same level of success,","in 1948 he was","Following his successful tour of England in 1933, Headley signed as a professional at Haslingden in the Lancashire League, where he played until the outbreak of war in 1939.","Even so, he was chosen as West Indies captain in 1948 against England, the first black player to be appointed to the position, although a combination of injuries and politics meant he only led his team for one Test Match.","Factual"
ObjectID(5527ea2ea21e5709f6e99104),"Sometimes people","when they had a debt and then pledged to work with another family.","went to become a slave","became slaves","Slavery in Toraja was often self-imposed as an alternative to starvation.","In this case, they became the family's property.","Paraphrase"
ObjectID(5527dacca21e3a63c2ac4b72),"Hurley lags behind as the survivors leave the beach, gets","a mysterious cabin.","separated, quickly finding","separated and finds","She gives her love to her sister, then dies.","He looks in the window and sees a figure in a rocking chair, then someone else steps right up to the glass.","Paraphrase"
ObjectID(5527de34a21e3a63c2ac606c),"City","to the top flight immediately by winning the Second Division championship in the 1985&ndash;86 season.Cite web","bounced back","made an immediate return","| accessdate = 2007-03-26","| url = ","Paraphrase"
ObjectID(5527e053a21e5709f6e96368),"Much of the play's language is courtly; elaborate, witty discourse,","Baldassare Castiglione's 1528 work, The Courtier.","fully consistent with","as recommended by","thumb|right|Hamlet's statement that his dark clothing is merely an outward representation of his inward grief reflects his strong rhetorical skill.(Artist: Eugène Delacroix 1834)","This work outlines several courtly rules, specifically advising royal retainers to amuse their masters with inventive language.","Paraphrase"
ObjectID(5527e469a21edceb734d2eff),"The observations suggest that the atmosphere is denser than was Voyager 2 measurements","","made by Voyager 2.","had indicated.","In the 1990s, various observations from Earth were made of the limb of Triton using the occultation of nearby stars, which indicated the presence of an atmosphere and an exotic surface.","See also","Other"
ObjectID(5527e550a21e0e4c0a9ddcce),"","holds the record for the most Premier League appearances, having played 536&nbsp;games.","Manchester United's Ryan Giggs","Gary Speed","The exact figure of the transfer fee was not disclosed, but was reported as being around £30 million. This was eclipsed by Manchester City's transfer of Robinho from Real Madrid on 1 September 2008 for £32.5&nbsp;million.","He is the only player to have competed in every season of the competition.","Factual"
ObjectID(5527ea2ba21e5709f6e9907e),"Strong kinship is actively reciprocal, meaning that they help","sharing buffalo rituals, and even indebtness.","farms each other,","each other in farming,","who can marry whom (Sandra 1998).","Children inherit house affiliation both from mother and father, including land and family debts.","Paraphrase"
ObjectID(5527ef6ea21e3a63c2acaa87),"","November 11, 2006, Reagan also lived the longest, dying at 93 years of age in 2004.","Until during","Reagan also had","He broke the record set in 1840 when William Henry Harrison was elected at 67 years of age and inaugerated at 68 years of age.","In 2001 he broke the record held by John Adams our second president who died on July 4, 1826.","X"
ObjectID(5527f5aea21e0e4c0a9e0f05),"""Baby Boy"" was written by Knowles, Storch, Paul, Robert","","Waller, Jay-Z and Sean Paul.","Waller and Jay-Z.","The track was produced by Scott Storch for Knowles debut solo studio album Dangerously in Love.","""Baby Boy"" was released on October 14, 2003 in the United States as the second single from the album.","Factual"
ObjectID(5527e6cba21e5709f6e97e82),"Men's teams are the Red","Lady Raiders, and Texas Tech is home to the 1993 NCAA Women's Basketball champions.","Raiders or","Raiders, women's teams are the","right|The ""Double T""Texas Tech is a member of the Big Twelve Conference and competes in Division I-A for athletics.","In 1999, the ""Goin' Band from Raiderland,"" a 400+ member marching band which was the first to travel extensively in support of its football team and the first college band to have its half-time performance broadcast over the radio, was awarded the Sudler Trophy.","Paraphrase"
ObjectID(5527dcf9a21e4a5a1c939ce2),"After some brief holding actions on the Peloponnese, the","Commonwealth forces had to be evacuated to Crete and Egypt.","Greeks, British and","Greek and British","In recognition of the valour displayed by Greek forces, the enlisted men were allowed to return to their homes (rather than being confined to POW camps) and officers were permitted to retain their sidearms.","The evacuation of nearly 40,000 soldiers was completed on April 28th, but was heavily contested by the German Luftwaffe, which managed to sink at least 26 troop-laden ships.","Paraphrase"
ObjectID(5527e6c4a21e5709f6e97e4b),"He was at the only facility in Australia where optical work could be done,","testing.","starting with  design then manufacture, right through assembly to","from design and manufacture to assembly and","98 The knowledge and experience Gascoigne gained during the war proved valuable.","Gascoigne developed a wide range of skills and ""finished up quite practical, especially with a screwdriver"".","Paraphrase"
ObjectID(5527ee6ea21e5709f6e9b577),"The","is a Ptolemaic era stele inscribed with the same passage of writing in two Egyptian language scripts (hieroglyphic and demotic) and in classical Greek.","fuck you bitch","Rosetta Stone","thumb|right|The Rosetta Stone in the British Museum.","It was created in 196&nbsp;BC, discovered by the French in 1799 at Rosetta, and translated in 1822 by Frenchman Jean-François Champollion.","Other"
ObjectID(5527d9c1a21e0e4c0a9da317),"Prior to the battle, the Persians demand that the Spartans drop their arms and surrender, which Leonidas refuses, challenging","come and take their weapons from them.","that the Persians","the Persians to","Leonidas, sympathetic to the eager warrior, rejects him upon realizing that Ephialtes cannot properly hold a shield, which would compromise the Spartan's phalanx.","Using their tightly-knit phalanx formation, the Spartans funnel the Persians into the narrow terrain and with superior fighting skill and resolve repeatedly rebuff the Persian army, inflicting heavy casualties.","Paraphrase"
ObjectID(5527e1dba21e5709f6e96847),"","final moments, Hamlet, at last, forces Claudius to drink from his own poisoned cup, and names Prince Fortinbras of Norway as his heir.","In his own","Hamlet stabs Claudius with the doped sword, then forces him","In his dying moments, Laertes is reconciled with Hamlet and reveals Claudius's murderous plot.","Horatio attempts to kill himself with the same poisoned wine, but is stopped by Hamlet, who commands him to tell his story, as he will be the only one left alive that could give a full account.","Factual"
ObjectID(5527d8eda21e4a5a1c938fd3),"When Jimmy Carter was inaugurated as president on 20 January 1977, Lennon and Ono were","the Inaugural Ball.","invited to attend","invited, and attended","With the departure of Nixon from the White House, the administration of his successor, Gerald Ford, showed little interest in continuing the battle.","Drugs, Meditation and Primal therapy","Factual"
ObjectID(5527e3cda21e5709f6e96e38),"","""Corea"" off the coast of China was also added.","The island of","An island marked","278. The Petworth House terrestrial globe of 1592 differs from the Middle Temple one in that the latter incorporates Raleigh's discoveries in Guiana and provides new place-names in Brazil and Peru, and on the continent of Africa.","The most extensive revision was that to the Northeast Passage, which was amended to take into account discoveries made on Willem Barents' third voyage to Novaya Zemlya in 1596.","Paraphrase"
ObjectID(5527e3dea21e5709f6e96ea7),"Only six of his globes are believed","in existence.","to be still","still to be","The globe-making industry in England died with him.","Three are in England, of which one pair consisting of a terrestrial and a celestial globe is owned by Middle Temple and displayed in its library, while a terrestrial globe is at Petworth House in Petworth, West Sussex.","Paraphrase"
ObjectID(5527ebcca21e3a63c2ac97e0),"Theoren Wallace ""Theo"" Fleury (born June 29, 1968 in Oxbow, Saskatchewan, Canada) is an","","unrestricted free agent who last played for the Chicago Blackhawks.","pro NHL ice hockey player for the Calgary Flames.","","Fleury was drafted by the Calgary Flames in the 8th round, 166th overall, of the 1987 NHL Entry Draft.","X"
ObjectID(5527e264a21edceb734d23c4),"In the 2004 elections, however, Congress returned to power in a surprise","rural populace.","result, primarily due to their appeal to the","result that was seen as a successful bid to the largely-neglected","It was only in 1999 that the right-wing Bharatiya Janata Party (BJP), a political outgrowth of the Jan Sangh, finally became the first non-Congress party to hold on to power for a full term in an unprecedented coalition with numerous regional allies.","See also:","Factual"
ObjectID(5527ebc7a21e3a63c2ac97a7),"","and has started a concrete sealing business.","Currently As of January, 2007, he resides in Calgary, Alberta, Canada,","After hockey Fleury resides in Calgary,","Fleury was part of an ownership group for the Calgary Hitmen that included wrestler Bret Hart and fellow hockey player Joe Sakic.","Fleury will be playing for the Calgary Vipers of the Golden Baseball League on August 9th, 2008, when they play the Yuma Scorpions at Foothills Stadium.","Paraphrase"
ObjectID(5527d678a21e5709f6e9339e),"","later John Ono Lennon, (October 9, 1940 &ndash; December 8, 1980), is best known as a singer, songwriter, and guitarist for The Beatles.","John Winston Lennon,","Michael Jay Sass,","right|thumb|John Lennon","His creative career also included the roles of solo musician, political activist, artist, actor, and author.","Factual"
ObjectID(5527df46a21e5709f6e95969),"Hamlet is one of the world's most famous","","attractions, and can be seen into form anywhere in the world.'","literary works, and has been translated into every major living language.","WORD B. Heathers head is the size of New Mexico Hamlet's ""To be, or not to be"" soliloquy (Act Three, Scene One), the most popular passage in the play, is so well known that it has become a stumbling-block for many modern actors.","Sources","Factual"
ObjectID(5527e52ba21edceb734d377c),"36 The guitarist asserted that unlike other bands of the shoegazing movement of the early 1990s,","did not use chorus or flanger pedals.","the band","My Bloody Valentine","488 This technique&mdash;nicknamed ""Glide guitar""&mdash;causes the guitar strings to bend slightly in and out of tune. Shields said that due to his use of the tremolo bar, ""People were thinking it's hundreds of guitars, when it's actually got less guitar tracks than most people's demo tapes have.""McGonigal, p.","He insisted, ""No other band played that guitar like me .","Factual"
ObjectID(5527ecc2a21e3a63c2ac9f1a),"Reagan's fiscal and tax policies have been accused of having increased social inequality and economic instability, despite the continued economic growth following the","","Tax Reform Act of 1982.","a series of tax reforms passed during his administration.","His denial of awareness of the Iran-Contra scandal was belied by quotations in now-archived notes by his defense secretary, Casper Weinberger, that he (Reagan) could survive violating the law or Constitution, but not the negative public image that ""big, strong Ronald Reagan passed up a chance to get the hostages free."" In December 1985, Reagan signed a secret presidential ""finding"" describing the deal as ""arms-for-hostages.""  Reagan-era papers which might provide further details were originally scheduled to be released starting in 2001, but President George W. Bush enacted a rule change to allow many of these to be withheld indefinitely.","His efforts to cut welfare were often criticised by the Democratic opposition (who nonetheless found themselves supporting and finally passing these cuts under President Clinton twenty years later.) The unprecedented growth of the national debt during his presidency also sparked charges of endangering the economic health of the nation.","Paraphrase"
ObjectID(5527f36aa21e3a63c2acb44a),"He died ten years later at the age of ninety-three, and ranks today","approval rating.","as one of the greatest presidents of the twentieth century","with a high","Reagan left office in 1989 and disclosed he had been diagnosed with Alzheimer's disease in 1994.","Early life","Factual"
ObjectID(5527ef3da21e5709f6e9bc95),"At the time, Nixon was stationed in","dealing with military contract terminations.","Baltimore and","Baltimore, Maryland, where he was assigned to use his legal training in","When Dexter finally turned the Committee down, he recommended Nixon, his onetime student.  Dexter died only days later of a heart attack, and Patton died in an auto accident before the 1946 campaign began.","In early November 1945, he flew to California to meet influential Republicans and give a speech at a Committee meeting.","Factual"
ObjectID(5527db4aa21e3a63c2ac5217),"The","Trujillo, Lambayeque and Piura; are most famous for guitar hymns like the piuran Tondero, the Lime�an Zamacueca, the Resbalosa and the bands of Marinera.","central and north coast","Marinera is the National Dance of Peru, named","She won a Grammy award in 2002 for her album Lamento Negro.","The Amazon has its own music.","Other"
