_id,prefix,suffix,oldPart,newPart,prevSent,nextSent,label
ObjectID(5527ecb5a21e3a63c2ac9ebd),"","welfare and social spending, eliciting protests from Democrats.","At the same time, the administration successfully slowed the growth of","Democrats protested at the  tax cuts accompanied by a large increase in military spending and cutbacks to","While ridiculed by opponents as ""voodoo,"" ""trickle-down,"" and ""Reaganomics,"" he managed to push his across-the-board tax cuts through the congress in 1981.","Following the recession of 1981-82, the economy staged a dramatic recovery beginning in 1983.","X"
ObjectID(5527ea58a21e5709f6e9926a),"Over two centuries, they ignored the mountainous area in the central Sulawesi, where Torajans","","were living, because it was poorly accessible and had unproductive land for agriculture.","lived, because access was difficult and it had little productive agricultural land.","From the 17th century, the Dutch established trade and political control on Sulawesi through the Dutch East Indies Company.","In the late 19th century, the Dutch became increasingly concerned about the spread of Islam in the south of Sulawesi, especially among the Makassarese and Bugis peoples.","Paraphrase"
ObjectID(5527eecca21e5709f6e9b96d),"The text on the stone is a decree from Ptolemy V,","and instructions to erect statues in temples.","describing the repeal of various taxes","i love to suck large lollipops","Comparative translation of the stone assisted in understanding many previously undecipherable examples of hieroglyphic writing.","Two Egyptian-Greek multilingual steles predated Ptolemy V's Rosetta Stone: Ptolemy III's Decree of Canopus, 239 BC, and Ptolemy IV's Decree of Memphis, ca 218 BC.","X"
ObjectID(5527dfb1a21e3a63c2ac6727),"The nature of the Borg, specifically as seen in First Contact has been the subject of","","considerable critical attention.","critical discussion.","In the end it is Lily (the 21st Century woman) who shows Picard (the 24th Century man) that his quest for revenge is the very primitive behaviour that humans had evolved to not use. There is a love theme between Lily Sloane and Picard, and the Vulcans at the end are representative of the biblical figures the Three Wise Men.","Author Joanna Zylinska notes that while other alien species are tolerated by humanity in Star Trek, the Borg are viewed differently due to their cybernetic alterations and the loss of personal freedom and autonomy.","Paraphrase"
ObjectID(5527d94da21e0e4c0a9da11e),"The remaining Spartans are killed in the hail of arrows, with Leonidas","","dying last.","finally falling after.","When Leonidas orders his man to cut down the messenger, Xerxes orders his archers to fire.","Dilios eventually returns to Sparta and inspires the council with the bravery of the 300.","Paraphrase"
ObjectID(5527da89a21e3a63c2ac4a1a),"Some","to deities other than the temple god.","of these had religious purposes, like chapels devoted","enclosures contained satellite chapels dedicated","The walls enclosed many buildings related to the temple's function.","The sacred lakes found in many temple enclosures served as reservoirs for the water used in rituals, as places for the priests to ritually cleanse themselves, and as representations of the water from which the world emerged.","Paraphrase"
ObjectID(5527d854a21e3a63c2ac3db7),"The","initiating the punk movement in the United Kingdom and creating the first generation gap within rock and roll.","band are widely credited with","Sex Pistols were responsible for","The Sex Pistols are an English punk rock band that formed in London in 1975.","The Sex Pistols originally comprised vocalist Johnny Rotten, guitarist Steve Jones, drummer Paul Cook and bassist Glen Matlock.","Paraphrase"
ObjectID(5527db93a21e0e4c0a9dad01),"Neo-Nazi land-tenure developments of late Song times were expropriated with the establishment of","","the Ming Dynasty.","Jackie Chan.","Hong Wu supported the creation of self-supporting agricultural communities.","Great land estates were confiscated by the government, fragmented and rented out; private slavery was forbidden.","Factual"
ObjectID(5527e7a4a21e5709f6e98368),"","planned for the Eighth Symphony to have four separate movements:","Initially, Mahler","Mahler had first","already composed.""Kennedy, Mahler, 149 While he did compose the work quickly, between June 21 and August 18, it may not initially have been that complete.","Veni, Creator Spiritus","Paraphrase"
ObjectID(5527e10aa21edceb734d1ae3),"","relationships with actresses Gwyneth Paltrow, Jennifer Aniston, and Angelina Jolie.","Pitt has been involved in high-profile","Following a high profile","Pitt has had his biggest commercial successes with Troy (2004) and Mr. & Mrs. Smith (2005).","Following a relationship with Paltrow, he was married to Aniston for five years.","Paraphrase"
ObjectID(5527e584a21e3a63c2ac80ae),"The annual interest payable on the bond","approximately £45&nbsp;million per annum, but the bond will not mature until 1 February 2017.","came to","which matures on","Bonds were issued in two tranches, one with a coupon rate of 8.75% worth £250&nbsp;million, and the other with a coupon rate of 8.375% worth $425&nbsp;million.","Despite its restructuring, the announcement about the club's debt prompted vociferous protests from Manchester United fans on the weekend of 23 January 2010, both at Old Trafford and at the club's Trafford Training Centre. A protest was organised by the club's supporters groups, encouraging match-going fans to wear green and gold, the colours of Manchester United's precursor club, Newton Heath.","Paraphrase"
ObjectID(5527e1e3a21e5709f6e96854),"The Tragedy of","or more simply Hamlet the gaylord , is a spazz","Harry hill, Prince of mentalists,","Hamlet, Prince of Denmark,","","Despite much literary detective work, the exact year of writing remains in dispute.","X"
ObjectID(5527dde2a21e4a5a1c93a33f),"The conflict was resolved","when the two agencies came to an agreement regarding construction of the new tollway.","on April 30, 1989,","in late April of 1985,","They also promised to prevent ISTHA from obtaining environmental approval from federal officials.","To protect the arboretum from salt spray and other pollutants caused by cars on the tollway, ISTHA agreed to build I-355 below grade around the perimeter of the arboretum.","X"
ObjectID(5527e89fa21e5709f6e9878d),"The original manuscript was slightly damaged in 1733 during a fire,","rebinding.","but  was damaged enough to require","and required","The two sections of the cartulary were first printed in 1723.","A new printed edition is in production as of 2009.","Paraphrase"
ObjectID(5527e078a21e3a63c2ac6d32),"MANCHESTER UNITED HAVE","","RECORDED NATHAN WALTERS TO HAVE THE LARGEST FOREHEAD.","BEEN DUMPED OUT OF THE CHAMPIONS LEAGUE BY BENFICA. TIME FOR A CHANGE!!.","After nearing bankuptcy in 1902, the club was taken over by J.H. Davies who changed its name to Manchester United.","United appointed Sir Matt Busby as manager after the Second World War, and his then-unheard-of policy of producing most of the players through the club's youth team brought great success, with the club winning the Football League in 1956 and 1957.","Other"
ObjectID(5527e115a21e0e4c0a9dc0f9),"Throughout the majority of the","York City have worn red shirts with white shorts.","clubs history,","history of the club,","","In the club's first season (1922–23), maroon shirts were worn, with white shorts and black socks.","Paraphrase"
ObjectID(5527dac5a21e3a63c2ac4b17),"For the use of Yellowhammer to refer to","Alabama, United States, see Northern Flicker","troops from","the state bird of","","","Factual"
ObjectID(5527ef35a21e5709f6e9bc43),"He continued to consider running for several months,","local Republicans.","to the frustration of","however, frustrating","Dexter was reluctant to give up his state post to run and sought assurance that he would receive another job if his candidacy failed.","As Dexter dithered, Republicans tried to get General George Patton to run, though they were not even certain if the general was a Republican, but a day after the Los Angeles Times speculated on the run, Patton announced from Germany his intent to ""keep completely out of politics"". The Committee also contacted Stanley Barnes, a rising young Republican attorney and former football star at the University of California, Berkeley, but he declined to be considered, skeptical of the chances of defeating the ""well-entrenched"" Voorhis.","Paraphrase"
ObjectID(5527ec08a21e3a63c2ac99b6),"","successful career in Hollywood as a second-rank leading man, as his face and body were as handsome as his voice.","Reagan had a","Regardless of his mediocre acting skills, Reagan had a moderately","Reagan smoothly improvised a fictional play-by-play (in which hitters on both teams gained a superhuman ability to foul off pitches) until the wire was restored.","His first screen credit was the starring role the 1937 movie Love is On the Air.","Factual"
ObjectID(5527de72a21e0e4c0a9db38b),"Wyatt later claimed this was not pre-planned and he simply informed Jardine what","","happened after the match.","had happened.","Under the captaincy of Bob Wyatt (Jardine having rested from the match), the England attack bowled short and around leg stump, with fielders positioned close by on the leg side to catch any deflections.","The Bodyline tactics continued in the next match and several players, including Jack Fingleton, were hit.Frith, pp.","Factual"
ObjectID(5527e029a21edceb734d15c2),"Though their marriage","considered the rare Hollywood success, rumors of trouble began circulating, and the Pitts announced their separation on January 7, 2005.","for years was","was, for years,","Under the settlement reached in January 2002, Pitt would design jewelry for Damiani that Aniston would model in ads, and the company would stop selling the copies.","As Pitt's marriage to Jennifer Aniston drew to a close, he and Angelina Jolie were involved in a well-publicized Hollywood scandal in which Jolie was often painted as the ""other woman"" who caused the divorce.","Paraphrase"
ObjectID(5527ec0ea21e3a63c2ac99d1),"","focused more on tax cuts and increased military spending (Reaganomics) than on reducing the national debt.","A type of fiscal conservatism","Fiscal policy","Among the positions that he propelled forward are the following:","Opposition to progressive taxation, government regulation in business and enviromental concerns, and abortion.","X"
ObjectID(5527d94ca21edceb734d0c4f),"Unlike many Hollywood celebrities he has remained largely non-political, working with both Republicans and Democrats, and using his celebrity status to help fight","","poverty and disease.","poverty, disease and improve global environmental conditions.","The philanthropic Pitt has been an active supporter of research into diseases, such as AIDS, which has had a devastating impact on Africa and other poor regions.","He was nominated for an Academy Award as Best Supporting Actor for his performance in the 1995 film Twelve Monkeys.","Factual"
ObjectID(5527e573a21e3a63c2ac8057),"The following season began with","the first ever Charity Shield – and ended with the club's first FA Cup title.","United picking up another piece of silverware –","victory in","After a second place finish in the 1905–06 Second Division season, Manchester United were promoted to the First Division, in which they won their first league title in 1908.","The club would have to wait another two years before winning any more silverware – winning the First Division for the second time in the 1910–11 season – which would prove to be the last time the club won the First Division for 41 years (the longest they have gone without winning the league in their history).Barnes et al.","X"
ObjectID(5527e5b8a21edceb734d3bcf),"","FRS (3 September 1728 &ndash; 17 August 2010) was an English manufacturer and business partner of Scottish engineer James Watt.","Fred Norm likes cheese,","Matthew Boulton,","","In the final quarter of the 18th century the partnership installed hundreds of Boulton & Watt steam engines, which were a great advance on the state of the art, making possible the mechanisation of factories and mills.","Other"
ObjectID(5527dc85a21e3a63c2ac5978),"The Peruvian elite  remained hesitant between emancipation and loyalty to the Crown thus, independence","","being proclaimed by the former on July 28, 1821.","was only achieved as a result of the military","By the early 19th-century, while most of South America was swept by wars of independence Peru remained a royalist stronghold.","Republic of Peru","Factual"
ObjectID(5527ee61a21e5709f6e9b4ce),"The British","and insisted only on the delivery of the monuments.","gave in","demanded all materials to be forfeit, and property of","After the French surrender, a dispute arose over the fate of French archaelogical and scientfic discoveries in Egypt.","The French tried to hide the Rosetta Stone in a boat despite the clauses of the capitulation, but failed.","Factual"
ObjectID(5527ed06a21edceb734d60b2),"They secure the television station which is broadcasting rebel propaganda, but the revolutionary leader","","eludes their grasp.","had already escaped.","A platoon from the USMC 1st Force Recon under the command of Lieutenant Vasquez rappels down from their UH-60 Black Hawk and searches the town for Al-Asad.","During the night, while the main USMC forces gradually push Al-Asad's forces back to his capital city, Vasquez's men secure a disable M1A2 Abrams main battle tank and escort it back to the highway.","Paraphrase"
ObjectID(5527f3c5a21e0e4c0a9e066f),"Supernova searches fall into two classes: those focussed on relatively nearby","","and those at a more extreme distance.","events and those looking for explosions farther away."," A neutrino is a particle that is produced in great quantities by a supernova explosion, and it is not obscured by the interstellar gas and dust of the galactic disk.","Due to the expansion of the universe, the distance of a remote object can be estimated by measuring the Doppler shift (or redshift) of its spectrum; on average, more distant objects will be receding with greater velocity than those nearby, and so will have a higher redshift.","X"
ObjectID(5527d673a21e4a5a1c9383d3),"Though the article was unnoticed in the UK, there was a severe backlash by conservative religious groups","","mainly in the rural South and Midwest states.","in the U.S. Radio stations banned the group's recordings, and their albums and other products were burned and destroyed.","Regardless, when read in the proper context of the article, Lennon sounds actually saddened that a rock group such as The Beatles became more important to many people than spirituality.","Radio stations banned the group's recordings, and their albums and other products were burned and destroyed.","X"
ObjectID(5527dd25a21e4a5a1c939dfb),"The Germans managed to capture in Kalamata around 7,000 Commonwealth and Yugoslav troops who had not been evacuated, while liberating many Italian prisoners from POW","","camps.Smith, p.","camps.Richter (1998), 595* Smith (1953), 112","Because of this event, the Germans realized that the evacuation was also taking place from the ports of East Peloponnese.Richter (1998), 584 On April 25, 4,700 more Australians were evacuated from Megara, and the few RAF squadrons left Greece; d'Albiac established his headquarters in Heraklion, Crete.Richter (1998), 585 The evacuation of about 43,000 soldiers was completed on April 28, but was heavily contested by the German Luftwaffe, which managed to sink at least twenty-six troop-laden ships.","112","Factual"
ObjectID(5527df9aa21edceb734d103c),"In 1991, Pitt starred as Joe Maloney in Across the Tracks in which he portrayed a young Californian athlete with a difficult criminal","","of a brother.","brother played by Rick Schroeder.","1991-1993","However, Pitt finally got his big break in one of that year's biggest hits: Thelma & Louise with a 15-minute mega-performance, showing off his toned physique, giving Geena Davis a good seeing to and then robbing her blind.","Factual"
ObjectID(5527ec6ba21e5709f6e9a2e0),"His principal work during these years was as a hydrographic surveyor, providing the navy with charts","accompanied by well-executed landscape drawings.","from all over the world, often","which were frequently","Apart from a brief period ashore in 1805, Heywood remained at sea in a succession of commands until 1816.","This skill may well have been the result of Bligh's tutelege in the earlier stages of the Bounty voyage; Bligh had written of Christian and Heywood: ""These two had been objects of my particular regard and attention, and I had taken great pains to instruct them.""Tagart, pp.","X"
ObjectID(5527d652a21e4a5a1c9381e2),"In Tasimboko, Edson's troops discovered","of food, ammunition, and medical supplies, and a powerful shortwave radio.","""vast stockpiles""","the supply base for Kawaguchi's forces, including large stockpiles","95–96.","The Marines seized documents and equipment, destroyed everything else in sight, and returned to the Lunga perimeter at 17:30.","Factual"
ObjectID(5527eb6aa21e5709f6e9994c),"Like the noble gas krypton , xenon can also be extracted by fractional distillation or liquefaction of liquid air and by selective adsorption on","","carbon (sort of coal).","activated carbon.","Extraction","Compounds","X"
ObjectID(5527d5d2a21e3a63c2ac2df2),"However, she is Jewish-American, not Italian, and has no","","royal connections.","connection to any title of nobility.","This consistent use of the original store name through her books, television show, and product line has led her fans to refer to her as simply ""the Contessa"".","Influences and rise to fame","Paraphrase"
ObjectID(5527e36fa21e0e4c0a9dcec1),"","to an end.","There is surely more to come before Sir Alex Ferguson's reign as manager comes","Having finished thrid in three out of the last four years, United's time may be coming","United have since maintained their reputation as one of the world's top club sides by winning three more Premiership titles and one FA Cup since the treble success.","Middlesbrough","Factual"
ObjectID(5527db4ca21e0e4c0a9dab84),"","","The Ming dynasty emperors would eventually be members of the Zhu family.","hey yall the ming dynasty is kool so be cool and look for it!!!!!!!!!!!!!!!!!!!!!!!!!!!!!!11","The revolt, led by Zhu Yuanzhang, established the Ming Dynasty in 1368.","After many years of fighting, the rebel group led by Zhu Yuanzhang, secretly assisted by an ancient, highly secret, intellectual fraternity called the Summer Place people, became the most powerful of the various Han Chinese groups.","Other"
ObjectID(5527ec0ea21e3a63c2ac99d6),"Many socially conservative commentators saw Reagan's handling of the AIDS crisis as a common sense approach","social immorality whose scope was not yet fully appreciated.","to a problem of","for a problem they believed was caused by","The most memorable ACT UP slogan confronting the Reagan/Bush stance was SILENCE= DEATH.","Many in the gay and lesbian communities and many people with AIDS, on the other hand, see his policies as anything from politically motivated willful blindness to outright contempt for the lives of non-heterosexuals.","Factual"
ObjectID(5527dfcaa21e3a63c2ac6784),"The script necessitated","designs, including a new USS Enterprise.","several new Starfleet ship","the creation of new starship","After two better known directors turned down the job, cast member Jonathan Frakes was chosen to direct to make sure the task fell to someone who understood Star Trek.","Production designer Herman Zimmerman and illustrator John Eaves collaborated to create a sleeker ship than its predecessor.","X"
ObjectID(5527d606a21e3a63c2ac2edf),"Under the guidance of","Garten reemerged in 1999 with her attention turned to the publishing industry.","Missus Pants and her advisor Roxie Boxer,","her husband,","thumb|right|Barefoot Contessa Cookbook","She carried on with the Barefoot Contessa name in her 1999 sleeper bestseller, The Barefoot Contessa Cookbook.","X"
ObjectID(5527db76a21e3a63c2ac5408),"Another 5% of peruvians are of African descent, especially in  coastal cities","Cañete, Chincha, Ica, as well as in the Peruvian North.","such as Lima,","of south of Lima in Ica Region like","The majority of them live in Peru's largest cities of the caost including Trujillo, Chiclayo, Piura and Lima.","Few black Peruvians identify themsleves as black, most common terms are Zambos (Mix Amerindian with black) and Mulatos (Mix white/criollo with black).","Factual"
ObjectID(5527f5b7a21e3a63c2acb82d),"","two-term governor Edmund G. ""Pat"" Brown, and was sworn into office on January 3, 1967.","He defeated","In Reagan's campaign, he emphasized two main themes: ""to send","California Republicans were impressed with Reagan's political views and charisma after his ""Time for Choosing"" speech, and nominated him for Governor of California in 1966.","In his first term, he froze government hiring and approved tax hikes to balance the budget.Cannon, (2001), p.","X"
ObjectID(5527d6f7a21e4a5a1c938826),"He lived in","class section of Liverpool from which The Beatles emerged.","the working","a fairly middle","While Lennon had little exposure to his Irish heritage growing up, he came to identify with it later in life.","On 15 July, 1958, when Lennon was 17, Julia was killed after being struck by a car driven by a drunk off-duty police officer.","Paraphrase"
ObjectID(5527e98da21e3a63c2ac91e5),"Snowfall is quite common between the months of December and March, snowing","be heavy once it snows.","only for few days or a week, but it could","for a week or two, but it can","Summer is by far the driest season, although there is no real summer drought as rain does occur all year round, and so the climate cannot be considered Mediterranean."," The city is also quite windy, having an average wind speed of 17 km/h (11 mph).","X"
ObjectID(5527edafa21e3a63c2aca4da),"In 1921, at the age of 10, Reagan was baptized","(although his brother, Neil, became a Catholic, like his father).","in his mother's Disciples of Christ church in Dixon","Catholic but never stayed a member of the Catholic church","In 1920, after years of moving from town to town, the family settled in Dixon, Illinois.","In 1924 Ronald Reagan began attending Dixon's Northside High School.","Paraphrase"
ObjectID(5527ea25a21e5709f6e9903c),"","decided to link the two lines at Ramsgate to allow through running between the two lines.","It was","The Southern Railway","Following the railway grouping of 1923, both the South Eastern Railway and the London, Chatham & Dover Railway became a part of the newly formed Southern Railway, which decided to address the duplication of lines and stations at Ramsgate and Margate.","This scheme had been proposed by the South Eastern and Chatham Railway before World War I, but work did not commence until 1925.Mitchell and Smith, § 104 This meant the closure of the terminus stations at Ramsgate Town and Ramsgate Harbour, and the construction of a line skirting the northern edge of the town to link the two existing lines.","X"
ObjectID(5527ec9ba21edceb734d5e2e),"A new laptop spawns after the old one has been re-captured or when the team holding the laptop does so for","whichever comes first.","65 seconds,","a preset amount of time,","If multiple players from the same team are within this area, the laptop is captured more quickly.","The first team to capture the laptop has the advantage, for the new HQ always appears closer and easier to access to the dominating team.","Factual"
ObjectID(5527ef04a21e0e4c0a9de907),"2–3 These remarks, perceived as pro-German,","perfect hail of denunciation"".Lockahrt, p.","received a storm of protest, ""hundreds of letters and scurrilous postcards, a","produced what Lang termed ""a","246-47 At a meeting in York in November 1914 he spoke out against excessive anti-German propaganda, and recalled a ""sacred memory"" of the Kaiser kneeling with King Edward VII at the bier of Queen Victoria. pp.","249  The strain of this period, coupled with the onset of alopecia, drastically altered Lang's appearance within months, from a young-looking dark-haired man to a bald and elderly-looking man. His friends were shocked; the King, meeting him on the Royal train, apparently burst into guffaws of laughter.Lockhart, p.","X"
ObjectID(5527d6cba21edceb734d0189),"PMID 10852536, but the meaning of this fact remains controversial and has led some researchers","MS is a heterogeneous disease.","it means that","to believe","Four different damage patterns have been identified in the scars of the brain tissueLucchinetti, C. Bruck, W. Parisi, J. Scherhauer, B. Rodriguez, M. Lassmann, H.Heterogeneity of multiple sclerosis lesions: implications for the pathogenesis of demyelination Ann Neurol, 2000; 47(6):707-17.","Other teams maintain that the shape of the scars can change from one type to another and this could be a marker of the disease action time.","X"
ObjectID(5527e40ba21e5709f6e97236),"The head and wings are","and the bill is shity pink.","black, the abdomen white, the back bluish-gray","blue, the ass brown, the white bluish-red","The largest known individual was about 46&nbsp;kg (101&nbsp;lb).","On the sides of the neck there are two golden circular nipples.","Other"
ObjectID(5527decda21e0e4c0a9db5d2),"Other than the","other medium weight draft horses.","coloration there are no notable conformation points outside of those found on","coloration, the American Cream physically resembles","Only the cream color is permitted in the breed.","See also","Factual"
